{
  "speaker_map": [
    {"id": "1", "speaker": "unknown", "candidates": ["crew"], "listener": "crew", "present_characters": ["capt_reyes"], "utterance_type": "dialogue", "confidence": "medium", "evidence_ids": ["sub:1"]},
    {"id": "2", "speaker": "capt_reyes", "listener": "chief_okafor", "present_characters": ["capt_reyes", "chief_okafor", "op_morgan"], "utterance_type": "dialogue", "confidence": "high", "evidence_ids": ["sub:2", "sub:3"]},
    {"id": "3", "speaker": "chief_okafor", "listener": "capt_reyes", "present_characters": ["capt_reyes", "chief_okafor", "op_morgan"], "utterance_type": "dialogue", "confidence": "high", "evidence_ids": ["sub:2"]},
    {"id": "4", "speaker": "capt_reyes", "listener": "op_morgan", "present_characters": ["capt_reyes", "chief_okafor", "op_morgan"], "utterance_type": "dialogue", "confidence": "medium", "evidence_ids": ["sub:11", "sub:12"]},
    {"id": "5", "speaker": "unknown", "candidates": ["distress_caller"], "listener": null, "present_characters": [], "utterance_type": "off_screen", "confidence": "low", "evidence_ids": ["sub:3", "sub:5"]},
    {"id": "6", "speaker": "op_morgan", "listener": "capt_reyes", "present_characters": ["capt_reyes", "chief_okafor", "op_morgan"], "utterance_type": "dialogue", "confidence": "medium", "evidence_ids": ["sub:4", "sub:6"]},
    {"id": "7", "speaker": "capt_reyes", "listener": "chief_okafor", "present_characters": ["capt_reyes", "chief_okafor", "op_morgan"], "utterance_type": "dialogue", "confidence": "high", "evidence_ids": ["sub:8"]},
    {"id": "8", "speaker": "chief_okafor", "listener": "capt_reyes", "present_characters": ["capt_reyes", "chief_okafor", "op_morgan"], "utterance_type": "dialogue", "confidence": "high", "evidence_ids": ["sub:8"]},
    {"id": "9", "speaker": "capt_reyes", "listener": "ens_cole", "present_characters": ["capt_reyes", "ens_cole"], "utterance_type": "dialogue", "confidence": "high", "evidence_ids": ["sub:9", "sub:10"]},
    {"id": "10", "speaker": "ens_cole", "listener": "capt_reyes", "present_characters": ["capt_reyes", "ens_cole"], "utterance_type": "dialogue", "confidence": "high", "evidence_ids": ["sub:9"]},
    {"id": "11", "speaker": "capt_reyes", "listener": "op_morgan", "present_characters": ["capt_reyes", "op_morgan"], "utterance_type": "dialogue", "confidence": "high", "evidence_ids": ["sub:11"]},
    {"id": "12", "speaker": "op_morgan", "listener": "capt_reyes", "present_characters": ["capt_reyes", "op_morgan"], "utterance_type": "dialogue", "confidence": "high", "evidence_ids": ["sub:11", "sub:12"]},
    {"id": "13", "speaker": "op_morgan", "listener": "crew", "present_characters": ["capt_reyes", "op_morgan"], "utterance_type": "dialogue", "confidence": "medium", "evidence_ids": ["sub:12", "sub:13"]},
    {"id": "14", "speaker": "chief_okafor", "listener": "capt_reyes", "present_characters": ["capt_reyes", "chief_okafor"], "utterance_type": "dialogue", "confidence": "medium", "evidence_ids": ["sub:14", "sub:17", "sub:21"]},
    {"id": "15", "speaker": "chief_okafor", "listener": "capt_reyes", "present_characters": ["capt_reyes", "chief_okafor"], "utterance_type": "dialogue", "confidence": "medium", "evidence_ids": ["sub:14"]},
    {"id": "16", "speaker": "chief_okafor", "listener": "capt_reyes", "present_characters": ["capt_reyes", "chief_okafor"], "utterance_type": "dialogue", "confidence": "medium", "evidence_ids": ["sub:14"]},
    {"id": "17", "speaker": "capt_reyes", "listener": "chief_okafor", "present_characters": ["capt_reyes", "chief_okafor"], "utterance_type": "dialogue", "confidence": "high", "evidence_ids": ["sub:14-16"]},
    {"id": "18", "speaker": "op_morgan", "listener": "ens_cole", "present_characters": ["op_morgan", "ens_cole"], "utterance_type": "dialogue", "confidence": "medium", "evidence_ids": ["sub:18", "sub:19"]},
    {"id": "19", "speaker": "ens_cole", "listener": "op_morgan", "present_characters": ["op_morgan", "ens_cole"], "utterance_type": "dialogue", "confidence": "high", "evidence_ids": ["sub:18"]},
    {"id": "20", "speaker": "capt_reyes", "listener": "chief_okafor", "present_characters": ["capt_reyes", "chief_okafor"], "utterance_type": "dialogue", "confidence": "high", "evidence_ids": ["sub:20", "sub:21"]},
    {"id": "21", "speaker": "chief_okafor", "listener": "capt_reyes", "present_characters": ["capt_reyes", "chief_okafor"], "utterance_type": "dialogue", "confidence": "high", "evidence_ids": ["sub:21"]},
    {"id": "22", "speaker": "chief_okafor", "listener": "ens_cole", "present_characters": ["chief_okafor", "ens_cole"], "utterance_type": "dialogue", "confidence": "high", "evidence_ids": ["sub:23", "sub:25"]},
    {"id": "23", "speaker": "ens_cole", "listener": "chief_okafor", "present_characters": ["chief_okafor", "ens_cole"], "utterance_type": "dialogue", "confidence": "high", "evidence_ids": ["sub:23"]},
    {"id": "24", "speaker": "chief_okafor", "listener": "ens_cole", "present_characters": ["chief_okafor", "ens_cole"], "utterance_type": "dialogue", "confidence": "high", "evidence_ids": ["sub:24", "sub:25"]},
    {"id": "25", "speaker": "ens_cole", "listener": "chief_okafor", "present_characters": ["chief_okafor", "ens_cole"], "utterance_type": "dialogue", "confidence": "high", "evidence_ids": ["sub:25"]},
    {"id": "26", "speaker": "ens_cole", "listener": "crew", "present_characters": ["capt_reyes", "ens_cole", "chief_okafor"], "utterance_type": "dialogue", "confidence": "medium", "evidence_ids": ["sub:26", "sub:27"]},
    {"id": "27", "speaker": "capt_reyes", "listener": "chief_okafor", "present_characters": ["capt_reyes", "ens_cole", "chief_okafor"], "utterance_type": "dialogue", "confidence": "high", "evidence_ids": ["sub:27", "sub:28"]},
    {"id": "28", "speaker": "chief_okafor", "listener": "capt_reyes", "present_characters": ["capt_reyes", "chief_okafor"], "utterance_type": "dialogue", "confidence": "high", "evidence_ids": ["sub:8", "sub:28"]},
    {"id": "29", "speaker": "capt_reyes", "listener": "ens_cole", "present_characters": ["capt_reyes", "ens_cole"], "utterance_type": "dialogue", "confidence": "high", "evidence_ids": ["sub:29", "sub:30"]},
    {"id": "30", "speaker": "ens_cole", "listener": "capt_reyes", "present_characters": ["capt_reyes", "ens_cole"], "utterance_type": "dialogue", "confidence": "high", "evidence_ids": ["sub:30"]}
  ],
  "character_profiles": [
    {
      "character_id": "capt_reyes",
      "display_names": ["Captain", "ma'am", "Reyes"],
      "role": {"value": "艦長・指揮官", "basis": "fact", "confidence": "high", "evidence_ids": ["sub:1", "sub:7"]},
      "age_range": {"value": "40代", "basis": "inference", "confidence": "low", "evidence_ids": []},
      "social_position": {"value": "艦の最上位", "basis": "fact", "confidence": "high", "evidence_ids": ["sub:1"]},
      "personality": {"value": "決断が速く簡潔。部下の功績は率直に認める", "basis": "inference", "confidence": "medium", "evidence_ids": ["sub:7", "sub:17", "sub:20", "sub:29"]},
      "public_demeanor": {"value": "命令は短く断定的", "basis": "fact", "confidence": "high", "evidence_ids": ["sub:7", "sub:27"]},
      "private_demeanor": {"value": "労いでは砕ける", "basis": "inference", "confidence": "medium", "evidence_ids": ["sub:29"]},
      "emotional_expressiveness": {"value": "低い（危機でも平叙）", "basis": "inference", "confidence": "medium", "evidence_ids": ["sub:17"]},
      "gender": "female",
      "gender_confidence": "high",
      "first_person_rules": {"default": "省略", "formal": "私", "casual": "省略", "intimate": null, "angry": "省略", "frightened": null, "comic": null, "self_directed": null, "public_speech": "私"},
      "address_rules": [
        {"listener_id": "chief_okafor", "default": "機関長", "variants": {"acknowledging": "君（功績を認める場面）"}, "evidence_ids": ["sub:2", "sub:20"]},
        {"listener_id": "ens_cole", "default": "コール少尉（sub:1-28）→ ダニー（sub:29-）", "variants": {}, "evidence_ids": ["sub:9", "sub:29"]},
        {"listener_id": "op_morgan", "default": "モーガン（姓呼び捨て）", "variants": {}, "evidence_ids": ["sub:11"]}
      ],
      "politeness_rules": [
        {"listener_id": "chief_okafor", "rules": "常体。命令形（〜しろ／〜を取れ）。労いは『君が正しかった』と断定形", "evidence_ids": ["sub:7", "sub:20", "sub:27"]},
        {"listener_id": "ens_cole", "rules": "常体・命令形。労いは短く（よくやった／休め）", "evidence_ids": ["sub:9", "sub:29"]}
      ],
      "sentence_ending_rules": {
        "neutral": "言い切り（〜だ／体言止め）",
        "question": "〜か（の・かしら 不使用）",
        "command": "命令形（〜しろ／〜へ）",
        "emotional_shifts": "危機でも文長・語彙を変えない",
        "assertion_style": "言い切る",
        "final_particles": "ほぼ使わない",
        "forbidden_endings": ["だわ", "かしら", "のよ", "わね"]
      },
      "preferred_vocabulary": [{"word": "簡潔な操船命令（針路・回頭・全速）", "context": "指揮時", "evidence_ids": ["sub:7", "sub:27"]}],
      "prohibited_vocabulary": ["感情的な強調語", "女性語尾"],
      "catchphrases": [],
      "emotion_rules": {
        "neutral": {"sentence_length": "短い", "vocabulary": "命令・操船用語", "politeness": "常体", "assertiveness": "強い", "ellipsis_tendency": "主語ほぼ常に省略", "hesitation": "なし", "sentence_ending": "命令形・言い切り", "address_shift": "役職呼び", "punctuation": "感嘆符は緊急時のみ", "evidence_ids": ["sub:7", "sub:27"]},
        "pleased": {"sentence_length": "短い", "vocabulary": "労いは平易（よくやった）", "politeness": "常体", "assertiveness": "強い", "ellipsis_tendency": "省略維持", "hesitation": "なし", "sentence_ending": "言い切り", "address_shift": "名前呼びに変化（ダニー）", "punctuation": "感嘆符なし", "evidence_ids": ["sub:29"]},
        "affectionate": "not_observed", "embarrassed": "not_observed", "irritated": "not_observed",
        "angry": "not_observed", "frightened": "not_observed", "grieving": "not_observed",
        "sarcastic": "not_observed", "authoritative": {"sentence_length": "最短", "vocabulary": "号令", "politeness": "常体", "assertiveness": "最大", "ellipsis_tendency": "目的語も省略", "hesitation": "なし", "sentence_ending": "命令形", "address_shift": "変化なし", "punctuation": "感嘆符可", "evidence_ids": ["sub:7"]},
        "deceptive": "not_observed", "exhausted": "not_observed"
      },